arg_id,prev_arg_id,Argument,Concern1,Concern2,Concern3,Concern4
Depth4_470,Depth3_84,"There is also the option of earning a scholarship true pure knowledge and efforts so, students don't necessarily need to put a load on their parents or themselves to get a good education.",scholarship,,,
Depth4_471,Depth3_84,"That is why the loans are so flexible with when students can repay them. They can manage their current situation and once they get a better job after the degree with higher pay, they can repay the loan back.",loan,job,,
Depth4_476,Depth3_84,"It's true that education is essential to better civilisation, but it IS accessible by all those who desire it. Nothing is impossible, there are plenty of options to earn money with a good job or even pay a loan.",loan,job,,
Depth4_484,Depth3_85,I agree with A1 Free education would be wasted on some people. they should seek education in other schools,free,,,
Depth4_486,Depth3_85,"Regardless whether education is a human right or not, making it free will only lower the quality available to everyone. Free education would be wasted on some people. ",free,,,
Depth4_491,Depth3_86,"Each student has a different financial background and hence, it is fair to treat them differently based on their wealth.",background,,,
Depth4_492,Depth3_86,"If they cannot repay the loan with their current income, they will not be forced. Everyone will pay according to their abilities, so that everyone can have a decent standard of living.",loan,,,
Depth4_496,Depth3_86,Those who earn less must have greater help if the intent is to continue. It's Not beneficial for any student to have debts.,debt,,,
Depth4_500,Depth3_91,The loans will be written off in the end and it is always a manageable rate to pay back meaning that it is affordable,loan,,,
Depth4_504,Depth3_91,Young people choosing education should not have to take loans to learn. Science should finance the state to teach theoretically and practically its future employees.,loan,,,
Depth4_505,Depth3_91,"In my opinion, it is an exaggeration to say that interest rates on student loans are high. For students there is a lower interest rate compared to other bank clients.
Going further, I do not agree that the loan repayment will take a very long time.",loan,interest,,
Depth4_516,Depth3_92,"To say that they have little to no other options is disingenuous, there are many careers that do not require university education. If they wish to pursue a career path that requires a degree this is a commitment and choice they have to balance. ",career,,,
Depth4_517,Depth3_92,"In that case, the students can get a job for one year at least before the university, to have a way to get access to a loan.",loan,job,access,
Depth4_518,Depth3_92,"The interest rates are far lower than any other kind of loan. Contact time is generally quite low, so you could easily fit a job in around that. Plus, there are always other options available, such as apprenticeships. ",loan,job,interest,
Depth4_523,Depth3_93,"there are no people in industrial occupations for this we have too many people behind the desk, they should seek education in other schools introduce school scholarships for poor but talented young people thanks to this, the willingness to learn will remain",scholarship,,,
Depth4_526,Depth3_93,There are scholarships and the like that reduce the financial burden on bright students if they do not come from ideal economic backgrounds. ,scholarship,background,,
Depth4_528,Depth3_93,There are grants and loans in place for that. It was announced recently that even universities like Cambridge are allocating extra places for low income students. ,loan,,,
Depth4_533,Depth3_94,"What if the state invests in students with poor results if they do not learn well.
I think if someone gets something for free, he does not appreciate it, if he pays for it from his own pocket, he respects it",free,,,
Depth4_535,Depth3_94,"I think that a college student who has financial problems always has the opportunity to receive a scholarship for the results of learning.
Additionally, he can also count on family help.",scholarship,,,
Depth4_538,Depth3_94,"That's the responsibility of schools, not universities. They should make pupils aware of all the options available, such as scholarships. ",scholarship,,,
Depth4_540,Depth3_95,"The loan doesn't count against their credit score and will be written off if they can't pay it back, so does not stop them from getting on with their lives ",loan,,,
Depth4_544,Depth3_95,Student loans should be found and a subsidy system should be created which in later years could be received by the state in interest-free installments directly from wages and salaries.,loan,,,
Depth4_545,Depth3_95,"The argument that not every student will find a financial situation to pay off the loan does not appeal to me, because in adult life you have to manage your finances in such a way as to be a plus.",loan,,,
Depth4_550,Depth3_96,"Scholarships should take into account everyone's position so they provide the most benefit. If scholarships are for the extraordinary, then there can't be that many otherwise they are not extraordinary just good",scholarship,,,
Depth4_553,Depth3_96,"If you get a non-returnable loan from school for very good academic results, you will not be worried about the money,
Â If you are also resourceful, you will be looking for a casual job during a break in the same classes you will be able to repair your budget",loan,job,,
Depth4_558,Depth3_96,"it's possible, but not definite. They could always try other universities or subjects. Not to mention the option of studying abroad where scholarships are more readily available. ",scholarship,,,
Depth4_561,Depth3_101,"The problem with no university fees is the possibility of overcrowding. Free education opens up institutions for everyone, while that is not a bad thing, this does cause the problem of overcrowding and too many on the same course. ",free,,,
Depth4_562,Depth3_101,People who currently have poorly paid jobs and bad life choices are from a mix of backgrounds including people with degrees so that won't be gotten rid of.,job,background,,
Depth4_564,Depth3_101,I come from a low income parent background and I see education a privilege and feel the value of paying for it keeps people in a stronger position for job prospects. Struggle sometimes is what makes people the best they can be.,job,background,,
Depth4_571,Depth3_102,"Yes, you have a point but surely this would create an unequal society. Free education brings people from different cultures and backgrounds to the same school where the aspect of social class may play out. This has the risk of causing an unequal society.",free,background,,
Depth4_572,Depth3_102,Debt is a way of funding things which would be hard or impossible to save for up front. The country itself is in significant debt and cannot afford to shoulder more debt just so uni students don't have to personally.,debt,afford,,
Depth4_575,Depth3_102,"The current system of student loans does not affect credit rating and functions well as a ""graduate-tax"". This means only those who use it are charged and both they and the state are not overburdened.",loan,,,
Depth4_576,Depth3_102,"Uni education should be paid for, if that means getting into debt then so be it. Tbh you get plenty of free time when at uni so go out & get a part time job or two to keep debt low. Too many students want to party, party, party",free,job,debt,
Depth4_582,Depth3_103,That is making an enormous assumption based on a small number of candidates. Most people accept uni debt as part of the price of qualifying and adhere to repayment terms.,debt,,,
Depth4_583,Depth3_103,"Yes student loans are only paid back when the person is earning a salary over a certain threshold. Therefore, the repayments will only be taken once the individual is in a decent job earning a reasonable amount of money.",loan,job,,
Depth4_585,Depth3_103,"Student loan repayments are only charged over a certain 'earnings-threshold' and are canceled after 30 years and do not affect credit rating. They therefore behave more like a ""graduate-tax"" than a loan.",loan,,,
Depth4_589,Depth3_104,The scholarships would be selective and so would have minimal effect of the impacts of the fees paid by paying students. Able students with lower incomes are able to benefit from the premium standard of education using subsidies from fee paying students,scholarship,,,
Depth4_591,Depth3_104,"I am not saying this is for rich people only, I said exceptional student - this can be all backgrounds. ",background,,,
Depth4_593,Depth3_104,"The fact that student loans are now available to everyone, actually makes education accessable to everyone and not just the rich: which used to be the case many years ago.",loan,,,
Depth4_605,Depth3_105,This seems pointless. Graduates pay a percentage of their earnings after graduating. Is it not fairer to charge them based on how wealthy they become after graduating rather than how wealthy their background is?,background,,,
Depth4_606,Depth3_105,Unless you earn the right to a scholarship then you should pay tuition fees & pay it back once earning a certain amount,scholarship,,,
Depth4_609,Depth3_106,"If students are keen to go to university, they can apply for a scholarship to lessen / negate any loans. Loans can be paid off dependent on their circumstances. A good degree will achieve a higher rate of pay over time and improve prospects",loan,scholarship,,
Depth4_611,Depth3_106,"However, the debts and interest rates will just get passed onto others via increased taxation. ",interest,debt,,
Depth4_620,Depth3_111,Student loans should be available for everyone. It gives people a better chance in life to succeed in a career they want to achieve. Money should be irrelevant when it comes to people's ambitions and education.,loan,career,,
Depth4_622,Depth3_111,"Loans will be available to all applicants and the payments will be means tested, so you will only ever be paying back an amount you can afford. The education will mean people can earn higher salaries and be less likely to live a life in debt.",loan,debt,afford,
Depth4_625,Depth3_111,"The debt that they get into will be minimal compared to the salary from a good job, earned through achieving a degree. So it will be affordable to pay back and they will not notice the repayments. ",job,debt,,
Depth4_633,Depth3_112,Courses and apprenticeships are a good alternative to a university degree for those from low income families. Scholarships should still be made available for those who demonstrate academic ability. Society gains as a whole from an educated population and the government should invest in this. ,scholarship,government,,
Depth4_635,Depth3_112,It is ultimately the learners choice how they wish to gain further education. I think the fees and scholarship program will help motivate students who really want to study. ,scholarship,,,
Depth4_636,Depth3_112,I think the prestige of a good university scholarship plus be more attractive to potential students,scholarship,,,
Depth4_646,Depth3_113,That is not true as better qualified people will enable companies to be more productive and the government therefore benefits from increased taxes on company profits,tax,government,,
Depth4_647,Depth3_113,"The majority of students that leave the university will be earning enough, which means the interest they pay back on their loans will cover the cost of the unpaid loans from others. This levels the debt but leaves the country better educated ",loan,interest,debt,
Depth4_648,Depth3_113,Low income families wouldnt even consider uni if they didnt have the student loan. If removed then they wouldn't be given a fair a chance,loan,,,
Depth4_653,Depth3_114,"Before taking out a loan, it should be compulsory to attend a meeting/lecture on what the loan entails and the debt that will accrue over time. without knowledge of this, financial pressure once leaving university could lead to further problems. ",loan,debt,,
Depth4_656,Depth3_114,"People will only save up to go to university if they can afford, if people save this is not the fault of the loan system",loan,afford,,
Depth4_657,Depth3_114,"Students cannot be blamed for flaws within the loan systems, this is the loan company's issue that needs to be corrected to allow people from all economic groups to be able to afford to better themselves",loan,afford,,
Depth4_659,Depth3_115,It is understandable that it is a concern that people need to consider if they can afford it but a student loan is an investment in themselves and their future,loan,afford,,
Depth4_666,Depth3_115,"Tuition fees are no the only factor accommodation costs are also a factor and this is no different to the housing market, I won't take a similar job in London because I couldn't afford to live their or commute from where I live know",job,afford,,
Depth4_667,Depth3_115,"Although I take this on board, loan companies do offer maintenance loans to pay for daily living costs, students can get part time jobs and many universities do offer grants to students from low income backgrounds to encourage people from all backgrounds to access further education ",loan,job,access,background
Depth4_669,Depth3_116,There are plenty of options to develop in a career path without university but if they wish to find a career that needs the formal education then they have that choice,career,,,
Depth4_673,Depth3_116,"Not all 'good careers' require further study after 18. As long as the options are there, either way, young people should be encouraged to make the most of their talents, skills and passions.",career,,,
Depth4_674,Depth3_116,No but further education leads to better jobs and also gives them more experience in life.,job,,,
Depth4_679,Depth3_121,"The career they will end up in as a result of studying at university will be much higher paid than if they did not pursue these qualifications, so it is way worth it in the end.",career,,,
Depth4_681,Depth3_121,"If they do not earn enough to repay the fees, they do not have to repay them until they do earn enough, thus, it does not present any financial strain on those who are concerned about loan repayment. ",loan,,,
Depth4_687,Depth3_121,"Exactly, most people do not get jobs related to their degree and so fees are good for ensuring greater focus on people's careers. If fees were abolished the problem would be far worse.",job,career,,
Depth4_689,Depth3_122,"So many people change their minds or waste their time and education during A-Levels (which are free), so having to pay for a higher education ensures they really do pick the right path and don't waste teachers' / lecturers time.",free,,,
Depth4_691,Depth3_122,"The fees are a necessary part of going to university. The university must be able to sustain itself without relying wholly on the government. Those who lie in lower economic groups will be heavily subsidised by grants and extra student loans, therefore university is accessible to all, despite economic background.",loan,government,background,
Depth4_698,Depth3_122,There is plenty of external help for hard to access careers for those who have the drive to work hard in the first place. This ensures the most passionate and motivated people are rewarded for their hard work.,access,career,,
Depth4_699,Depth3_123,Access to such advice is not mandatory but should unquestionably be offered for such a huge life changing decision. ,access,,,
Depth4_702,Depth3_123,"It is a choice, students can choose not to go to university and avoid the debt. In the same way, they can choose to go and sign up for the debt if it means they will have more opportunities later on. Students are not compelled to take HE pathways. ",debt,,,
Depth4_703,Depth3_123,The student loan system for tuition fees is paid back at a small percentage depending on the individuals earnings. ,loan,,,
Depth4_707,Depth3_123,Yes but that money isn' payable until they are earning above a certain threshold in their career and therefore should not put them off applying to university.,career,,,
Depth4_712,Depth3_124,"If people are really put off by the debt, then they will be comfortable accessing an alternative to higher education, like an apprenticeship or a job. The debt burden is part and parcel of getting access to the opportunities that graduates have over people without a degree. ",job,access,debt,
Depth4_716,Depth3_124,"Loans which are for university purposes have a lower interest rate than your typical loan. Therefore, again if they get a good job it should not be hard to pay back.",loan,job,interest,
Depth4_717,Depth3_124,Yes but it is only repayable above a certain threshold and if the person never attains that threshold the debt will be erased.,debt,,,
Depth4_724,Depth3_125,"We have to give everyone equal chance to succeed and end up with the best job they can, naturally there will be those who reach the top, and those who don't. ",job,,,
Depth4_726,Depth3_125,Student's tend to go to university to study a topic they are passionate about not just for courses which are going to get them a job with the highest of high payment.,job,,,
Depth4_727,Depth3_125,You cannot only charge fees for certain degrees as that would have far reaching consequences. People working in lower paid jobs may never have to repay any of the loan anyway if they do not earn above the threshold.,loan,job,,
Depth4_735,Depth3_126,There would still be a shortage if most young people decided to go to university instead of going into more vocationally and apprenticeship type jobs. ,job,,,
Depth4_736,Depth3_126,But if every student had the opportunity to go to university for free most would take it and some will not actually take the course seriously resulting in poor qualifications. There are also people who prefer working in construction.,free,,,
Depth4_740,Depth3_131,"The loan repayments are affordable, have a low interest level and proportionate to wages therefore it won't be vast repayments as such ",loan,interest,,
Depth4_744,Depth3_131,There isn't the public funding available to offer free university places to the growing number of students who wish to stay in education and achieve degrees.,free,,,
Depth4_748,Depth3_131,Then tax payers have to pay for them instead and will also have less expendable income,tax,,,
Depth4_749,Depth3_132,"If an individual is motivated to become something through going to university, fees and repayment will not stop them because student loan will help them and at the end of the course, they will be earning a good amount ",loan,,,
Depth4_750,Depth3_132,"Those jobs you mention are vocations, people who chose to study them have thought about fees in making their decision. ",job,,,
Depth4_751,Depth3_132,"The fees cover the experience you will gain, you cannot get education and improve yourself for free. The life time benefits in terms of experience, well being and income increases from being in a high paid profession are worth it",free,,,
Depth4_764,Depth3_133,Because it is impossible to begin selecting which jobs are morally good enough that they deserve to have their fees scrapped. Everyone will have their own opinion as to which jobs contribute back to society.,job,,,
Depth4_766,Depth3_133,Everyone who has a job is contributing to society and to the economy so I'm not sure why those professions should be singled out. It costs the university money to teach them and it costs the government money to provide financial support so why should this not be repaid,job,government,,
Depth4_767,Depth3_133,"They have used a service to train them for their chosen career, so why should you not pay for a service.",career,,,
Depth4_773,Depth3_134,"Although all sorts of careers are useful in society, some are harder to get into",career,,,
Depth4_774,Depth3_134,"University fees are the same for everyone across the board (at the same university). If a person from a lower-income background is talented enough, they will have the same chances of getting the job.",job,background,,
Depth4_785,Depth3_135,"If a degree is not needed to do a certain job then it is personal choice to progress down that path, and they should accept the fees.",job,,,
Depth4_793,Depth3_136,"If young peoples university fees are paid for, there will be many students studying courses that they are not fully interested in because they will not have the question of whether university is worth being in debt for in their mind",debt,,,
Depth4_794,Depth3_136,I agree. The education in high schools/colleges should give the advantages and disadvantages of both university education and apprenticeships. Some people will benefit from learning on the job rather than academia.,job,,,
Depth4_796,Depth3_136,"I agree that university is not the answer to everything and there are many career avenues available, however for those who want to go it only seems fair that they pay for this service",career,,,
Depth4_797,Depth3_136,"Other people shouldn't have increased taxes due to free education , if you want to go to university it is your choice so you should be accountable for the fees.",free,tax,,
Depth4_799,Depth3_141,"you don't have to pay the debt off until you're earning a certain amount and even when you do, it's a tiny fraction, still giving you enough money to live off",debt,,,
Depth4_801,Depth3_141,You don't have to repay the debt at an unrealistic rate if you do take the loan you would find the repayment manageable even on lesser earning jobs,loan,job,debt,
Depth4_804,Depth3_141,the interest rates will be very low so students who go on to graduate and get good jobs will be paying back the loan at a cheaper rate than if they took out a loan elsewhere to keep studying. ,loan,job,interest,
Depth4_811,Depth3_142,Everyone does have a choice on what they want to do if you are not happy in your job you are entitled to move,job,,,
Depth4_813,Depth3_142,"by choosing to complete a degree increases maturity, life experiences and a passion for your job",job,,,
Depth4_814,Depth3_142,those in a non stem field can still get good jobs and it is only when they earn a certain amount they will start paying off their loan slowly. ,loan,job,,
Depth4_820,Depth3_143,"Not everyone goes to university though, which is annoying for them because they would be paying much higher taxes for something they do not care about",tax,,,
Depth4_821,Depth3_143,University is not an essential service it is higher education. If that was the case then everyone should have access to university regardless of exam results. It's just not feasible ,access,,,
Depth4_824,Depth3_143,"Plain and simple those who study at university need to pay the services, we have had student loans for decades now. Not everyone wants to study at university and will probably work and pay taxes anyway, ",loan,tax,,
Depth4_831,Depth3_144,Student loans are vital for those not in positions to pay for tuition fees upfront it has a much more positive factor than a negative factor. The fact it allows people who wouldn't usually be able to go to go can have a great benefit to society ,loan,,,
Depth4_833,Depth3_144,I dont believe people go to university clueless. They have chosen to follow a career path that a lot of thought has gone into.,career,,,
Depth4_835,Depth3_144,Free university education would encourage even more of what you have just suggested (people going to university without any idea where they're heading).,free,,,
Depth4_839,Depth3_145,"if they don't get a ""good"" job, then they don't have to pay back their debt until they do. Being university schooled, they should be able to get a better job when it becomes available, ",job,debt,,
Depth4_845,Depth3_145,The students will only ever have to pay back the loan at a rate they they can reasonably afford.,loan,afford,,
Depth4_848,Depth3_145,that should not be sufficient argument to increase the tax burden on all in society. surely your argument supports limiting places in universities to prevent overcrowding in the graduate market?,tax,,,
Depth4_852,Depth3_146,"There is no rush to pay it back, it is just like tax. Automatically taken after a certain income",tax,,,
Depth4_855,Depth3_146,"As I have pointed out earlier, the graduates will not have to worry if they don't get a job because this will likely mean they aren't earning enough to pay the loan back.",loan,job,,
Depth4_858,Depth3_146,"But once university finished there should not be a requirement for post graduates to be supported through means other than those in wider society, unemployment benefit and the like. There are huge 8ncentives for students from poorer backgrounds but this should not go further.",background,,,
Depth4_860,Depth3_151,"The debt is only paid back once you earn over a certain figure, this is then repaid at 9% of the amount over this figure. Earning less than this will mean you never have to repay your loan.",loan,debt,,
Depth4_862,Depth3_151,"Student fees are less like a debt and more like a tax, and the government is very lenient on how they are paid back. People who want a university education should be willing to accept the fees as something that is necessary. ",tax,government,debt,
Depth4_866,Depth3_151,Fees help students to value education and take it seriously. It gives them an insight into the real world and helps them recognise that not everything will be free and they will indeed have to work for it.,free,,,
Depth4_872,Depth3_152,"It doesn't matter whether or not they have their own expenses to deal with, as they will only have to pay back university loans after they start making a certain amount of money, and after around 30 years the debt is dropped completely anyway.",loan,debt,,
Depth4_875,Depth3_152,There is lots of finical support for a young person during there time studying. A young person should be encouraged to have a part time job as well as studying as this prepares them for working life.,job,,,
